{
  "schema_version": "1.0",
  "dossier_id": "replace-with-lowercase-dossier-id",
  "officers": [
    {"role":"compliance_mlro","primary_subject":"REPLACE_WITH_PRIMARY_SUBJECT","alternate_subject":"REPLACE_WITH_DISTINCT_ALTERNATE_SUBJECT","appointment_ref":{"id":"mlro-appointment-v1","title":"REPLACE_WITH_TITLE","uri":"https://replace.example/mlro-appointment.pdf","sha256":"REPLACE_WITH_64_LOWERCASE_HEX_SHA256","owner_subject":"REPLACE_WITH_OWNER","reviewer_subject":"REPLACE_WITH_DIFFERENT_REVIEWER","version":"v1","issued_at":"2026-08-28T00:00:00Z"},"training_ref":{"id":"mlro-training-v1","title":"REPLACE_WITH_TITLE","uri":"https://replace.example/mlro-training.pdf","sha256":"REPLACE_WITH_64_LOWERCASE_HEX_SHA256","owner_subject":"REPLACE_WITH_OWNER","reviewer_subject":"REPLACE_WITH_DIFFERENT_REVIEWER","version":"v1","issued_at":"2026-08-28T00:00:00Z"},"conflict_declaration_ref":{"id":"mlro-conflict-v1","title":"REPLACE_WITH_TITLE","uri":"https://replace.example/mlro-conflict.pdf","sha256":"REPLACE_WITH_64_LOWERCASE_HEX_SHA256","owner_subject":"REPLACE_WITH_OWNER","reviewer_subject":"REPLACE_WITH_DIFFERENT_REVIEWER","version":"v1","issued_at":"2026-08-28T00:00:00Z"},"recusal_rules_ref":{"id":"mlro-recusal-v1","title":"REPLACE_WITH_TITLE","uri":"https://replace.example/mlro-recusal.pdf","sha256":"REPLACE_WITH_64_LOWERCASE_HEX_SHA256","owner_subject":"REPLACE_WITH_OWNER","reviewer_subject":"REPLACE_WITH_DIFFERENT_REVIEWER","version":"v1","issued_at":"2026-08-28T00:00:00Z"}},
    {"role":"security","primary_subject":"REPLACE_WITH_PRIMARY_SUBJECT","alternate_subject":"REPLACE_WITH_DISTINCT_ALTERNATE_SUBJECT","appointment_ref":{"id":"security-appointment-v1","title":"REPLACE_WITH_TITLE","uri":"https://replace.example/security-appointment.pdf","sha256":"REPLACE_WITH_64_LOWERCASE_HEX_SHA256","owner_subject":"REPLACE_WITH_OWNER","reviewer_subject":"REPLACE_WITH_DIFFERENT_REVIEWER","version":"v1","issued_at":"2026-08-28T00:00:00Z"},"training_ref":{"id":"security-training-v1","title":"REPLACE_WITH_TITLE","uri":"https://replace.example/security-training.pdf","sha256":"REPLACE_WITH_64_LOWERCASE_HEX_SHA256","owner_subject":"REPLACE_WITH_OWNER","reviewer_subject":"REPLACE_WITH_DIFFERENT_REVIEWER","version":"v1","issued_at":"2026-08-28T00:00:00Z"},"conflict_declaration_ref":{"id":"security-conflict-v1","title":"REPLACE_WITH_TITLE","uri":"https://replace.example/security-conflict.pdf","sha256":"REPLACE_WITH_64_LOWERCASE_HEX_SHA256","owner_subject":"REPLACE_WITH_OWNER","reviewer_subject":"REPLACE_WITH_DIFFERENT_REVIEWER","version":"v1","issued_at":"2026-08-28T00:00:00Z"},"recusal_rules_ref":{"id":"security-recusal-v1","title":"REPLACE_WITH_TITLE","uri":"https://replace.example/security-recusal.pdf","sha256":"REPLACE_WITH_64_LOWERCASE_HEX_SHA256","owner_subject":"REPLACE_WITH_OWNER","reviewer_subject":"REPLACE_WITH_DIFFERENT_REVIEWER","version":"v1","issued_at":"2026-08-28T00:00:00Z"}},
    {"role":"product_risk","primary_subject":"REPLACE_WITH_PRIMARY_SUBJECT","alternate_subject":"REPLACE_WITH_DISTINCT_ALTERNATE_SUBJECT","appointment_ref":{"id":"product-risk-appointment-v1","title":"REPLACE_WITH_TITLE","uri":"https://replace.example/product-risk-appointment.pdf","sha256":"REPLACE_WITH_64_LOWERCASE_HEX_SHA256","owner_subject":"REPLACE_WITH_OWNER","reviewer_subject":"REPLACE_WITH_DIFFERENT_REVIEWER","version":"v1","issued_at":"2026-08-28T00:00:00Z"},"training_ref":{"id":"product-risk-training-v1","title":"REPLACE_WITH_TITLE","uri":"https://replace.example/product-risk-training.pdf","sha256":"REPLACE_WITH_64_LOWERCASE_HEX_SHA256","owner_subject":"REPLACE_WITH_OWNER","reviewer_subject":"REPLACE_WITH_DIFFERENT_REVIEWER","version":"v1","issued_at":"2026-08-28T00:00:00Z"},"conflict_declaration_ref":{"id":"product-risk-conflict-v1","title":"REPLACE_WITH_TITLE","uri":"https://replace.example/product-risk-conflict.pdf","sha256":"REPLACE_WITH_64_LOWERCASE_HEX_SHA256","owner_subject":"REPLACE_WITH_OWNER","reviewer_subject":"REPLACE_WITH_DIFFERENT_REVIEWER","version":"v1","issued_at":"2026-08-28T00:00:00Z"},"recusal_rules_ref":{"id":"product-risk-recusal-v1","title":"REPLACE_WITH_TITLE","uri":"https://replace.example/product-risk-recusal.pdf","sha256":"REPLACE_WITH_64_LOWERCASE_HEX_SHA256","owner_subject":"REPLACE_WITH_OWNER","reviewer_subject":"REPLACE_WITH_DIFFERENT_REVIEWER","version":"v1","issued_at":"2026-08-28T00:00:00Z"}},
    {"role":"treasury_custody","primary_subject":"REPLACE_WITH_PRIMARY_SUBJECT","alternate_subject":"REPLACE_WITH_DISTINCT_ALTERNATE_SUBJECT","appointment_ref":{"id":"treasury-appointment-v1","title":"REPLACE_WITH_TITLE","uri":"https://replace.example/treasury-appointment.pdf","sha256":"REPLACE_WITH_64_LOWERCASE_HEX_SHA256","owner_subject":"REPLACE_WITH_OWNER","reviewer_subject":"REPLACE_WITH_DIFFERENT_REVIEWER","version":"v1","issued_at":"2026-08-28T00:00:00Z"},"training_ref":{"id":"treasury-training-v1","title":"REPLACE_WITH_TITLE","uri":"https://replace.example/treasury-training.pdf","sha256":"REPLACE_WITH_64_LOWERCASE_HEX_SHA256","owner_subject":"REPLACE_WITH_OWNER","reviewer_subject":"REPLACE_WITH_DIFFERENT_REVIEWER","version":"v1","issued_at":"2026-08-28T00:00:00Z"},"conflict_declaration_ref":{"id":"treasury-conflict-v1","title":"REPLACE_WITH_TITLE","uri":"https://replace.example/treasury-conflict.pdf","sha256":"REPLACE_WITH_64_LOWERCASE_HEX_SHA256","owner_subject":"REPLACE_WITH_OWNER","reviewer_subject":"REPLACE_WITH_DIFFERENT_REVIEWER","version":"v1","issued_at":"2026-08-28T00:00:00Z"},"recusal_rules_ref":{"id":"treasury-recusal-v1","title":"REPLACE_WITH_TITLE","uri":"https://replace.example/treasury-recusal.pdf","sha256":"REPLACE_WITH_64_LOWERCASE_HEX_SHA256","owner_subject":"REPLACE_WITH_OWNER","reviewer_subject":"REPLACE_WITH_DIFFERENT_REVIEWER","version":"v1","issued_at":"2026-08-28T00:00:00Z"}},
    {"role":"consumer_protection","primary_subject":"REPLACE_WITH_PRIMARY_SUBJECT","alternate_subject":"REPLACE_WITH_DISTINCT_ALTERNATE_SUBJECT","appointment_ref":{"id":"consumer-appointment-v1","title":"REPLACE_WITH_TITLE","uri":"https://replace.example/consumer-appointment.pdf","sha256":"REPLACE_WITH_64_LOWERCASE_HEX_SHA256","owner_subject":"REPLACE_WITH_OWNER","reviewer_subject":"REPLACE_WITH_DIFFERENT_REVIEWER","version":"v1","issued_at":"2026-08-28T00:00:00Z"},"training_ref":{"id":"consumer-training-v1","title":"REPLACE_WITH_TITLE","uri":"https://replace.example/consumer-training.pdf","sha256":"REPLACE_WITH_64_LOWERCASE_HEX_SHA256","owner_subject":"REPLACE_WITH_OWNER","reviewer_subject":"REPLACE_WITH_DIFFERENT_REVIEWER","version":"v1","issued_at":"2026-08-28T00:00:00Z"},"conflict_declaration_ref":{"id":"consumer-conflict-v1","title":"REPLACE_WITH_TITLE","uri":"https://replace.example/consumer-conflict.pdf","sha256":"REPLACE_WITH_64_LOWERCASE_HEX_SHA256","owner_subject":"REPLACE_WITH_OWNER","reviewer_subject":"REPLACE_WITH_DIFFERENT_REVIEWER","version":"v1","issued_at":"2026-08-28T00:00:00Z"},"recusal_rules_ref":{"id":"consumer-recusal-v1","title":"REPLACE_WITH_TITLE","uri":"https://replace.example/consumer-recusal.pdf","sha256":"REPLACE_WITH_64_LOWERCASE_HEX_SHA256","owner_subject":"REPLACE_WITH_OWNER","reviewer_subject":"REPLACE_WITH_DIFFERENT_REVIEWER","version":"v1","issued_at":"2026-08-28T00:00:00Z"}},
    {"role":"incident_commander_cbn_liaison","primary_subject":"REPLACE_WITH_PRIMARY_SUBJECT","alternate_subject":"REPLACE_WITH_DISTINCT_ALTERNATE_SUBJECT","appointment_ref":{"id":"incident-appointment-v1","title":"REPLACE_WITH_TITLE","uri":"https://replace.example/incident-appointment.pdf","sha256":"REPLACE_WITH_64_LOWERCASE_HEX_SHA256","owner_subject":"REPLACE_WITH_OWNER","reviewer_subject":"REPLACE_WITH_DIFFERENT_REVIEWER","version":"v1","issued_at":"2026-08-28T00:00:00Z"},"training_ref":{"id":"incident-training-v1","title":"REPLACE_WITH_TITLE","uri":"https://replace.example/incident-training.pdf","sha256":"REPLACE_WITH_64_LOWERCASE_HEX_SHA256","owner_subject":"REPLACE_WITH_OWNER","reviewer_subject":"REPLACE_WITH_DIFFERENT_REVIEWER","version":"v1","issued_at":"2026-08-28T00:00:00Z"},"conflict_declaration_ref":{"id":"incident-conflict-v1","title":"REPLACE_WITH_TITLE","uri":"https://replace.example/incident-conflict.pdf","sha256":"REPLACE_WITH_64_LOWERCASE_HEX_SHA256","owner_subject":"REPLACE_WITH_OWNER","reviewer_subject":"REPLACE_WITH_DIFFERENT_REVIEWER","version":"v1","issued_at":"2026-08-28T00:00:00Z"},"recusal_rules_ref":{"id":"incident-recusal-v1","title":"REPLACE_WITH_TITLE","uri":"https://replace.example/incident-recusal.pdf","sha256":"REPLACE_WITH_64_LOWERCASE_HEX_SHA256","owner_subject":"REPLACE_WITH_OWNER","reviewer_subject":"REPLACE_WITH_DIFFERENT_REVIEWER","version":"v1","issued_at":"2026-08-28T00:00:00Z"}}
  ],
  "authority_matrix": [
    {"decision":"external payment release","permitted_roles":["treasury_custody","compliance_mlro"],"dual_control":true,"prohibited_self_approval":true,"audit_event_type":"payment_release_authority"},
    {"decision":"test-limit change","permitted_roles":["product_risk","compliance_mlro"],"dual_control":true,"prohibited_self_approval":true,"audit_event_type":"test_limit_change"},
    {"decision":"incident declaration","permitted_roles":["incident_commander_cbn_liaison","security"],"dual_control":true,"prohibited_self_approval":true,"audit_event_type":"material_incident_declaration"}
  ],
  "access_governance": {
    "mfa_required_for_privileged_access": true,
    "last_access_review_ref": {"id":"access-review-v1","title":"REPLACE_WITH_TITLE","uri":"https://replace.example/access-review.pdf","sha256":"REPLACE_WITH_64_LOWERCASE_HEX_SHA256","owner_subject":"REPLACE_WITH_OWNER","reviewer_subject":"REPLACE_WITH_DIFFERENT_REVIEWER","version":"v1","issued_at":"2026-08-28T00:00:00Z"},